{
  "$schema": "./catalog.schema.json",
  "generatedFrom": [
    "design-system.manifest.json",
    "design-system/authority.json"
  ],
  "scope": {
    "include": [
      "The Social Vibecoding React platform shell",
      "Platform-owned routes and reusable shell patterns",
      "The shell-side hosted-app frame and compatibility adapters"
    ],
    "exclude": [
      "Child-app source code and visual identity",
      "The app-factory scaffold and prompts",
      "The hosted usernode-native/v1 compatibility contract"
    ]
  },
  "authority": {
    "owner": "frontend-platform",
    "approverRole": "shell-design-system-approver",
    "canonicalTokens": "design-system/tokens.json",
    "componentManifest": "design-system.manifest.json",
    "resolvedCatalog": "design-system/catalog.json",
    "relationshipAuthority": "design-system/relationships.json",
    "registry": "registry.json",
    "exceptionLedger": "design-system/exceptions.json",
    "interfaceLaws": "design-system/interface-laws.md",
    "navigationLedger": "design-system/navigation-ledger.json",
    "contentGuidelines": "design-system/content-guidelines.md",
    "contentContractSchema": "design-system/content-contract.schema.json",
    "contentExceptionLedger": "design-system/content-exceptions.json"
  },
  "components": [
    {
      "id": "primitive-accordion",
      "name": "Accordion",
      "tier": "element",
      "module": "@/components/ui/accordion.tsx",
      "export": "Accordion",
      "owner": "frontend-platform",
      "maturity": "stable",
      "distribution": "shell-internal",
      "variants": [
        "Closed",
        "Open"
      ],
      "tokens": [
        "foundation.font.sans",
        "foundation.radius.base",
        "semantic.light.*",
        "semantic.dark.*"
      ],
      "accessibility": {
        "contract": [
          "Use semantic elements and accessible names for every interactive control.",
          "Support keyboard operation and visible focus wherever the pattern is interactive.",
          "Keep serious and critical Storybook accessibility violations at zero."
        ],
        "evidence": "Dedicated Accordion Storybook states plus the styled Storybook accessibility gate."
      },
      "dataBoundary": {
        "kind": "props-only",
        "contract": "The official local primitive receives presentation and interaction props only; routes and adapters retain application data, persistence, transport, and authorization ownership."
      },
      "responsive": [
        "narrow-mobile",
        "wide-desktop"
      ],
      "deprecation": null,
      "evidence": {
        "story": "@/components/ui/accordion.stories.tsx",
        "states": [
          "Closed",
          "Open"
        ]
      }
    },
    {
      "id": "primitive-alert-dialog",
      "name": "AlertDialog",
      "tier": "element",
      "module": "@/components/ui/alert-dialog.tsx",
      "export": "AlertDialog",
      "owner": "frontend-platform",
      "maturity": "stable",
      "distribution": "shell-internal",
      "variants": [
        "Trigger",
        "Open",
        "CompactOpen"
      ],
      "tokens": [
        "foundation.font.sans",
        "foundation.radius.base",
        "semantic.light.*",
        "semantic.dark.*"
      ],
      "accessibility": {
        "contract": [
          "Use semantic elements and accessible names for every interactive control.",
          "Support keyboard operation and visible focus wherever the pattern is interactive.",
          "Keep serious and critical Storybook accessibility violations at zero."
        ],
        "evidence": "Dedicated AlertDialog Storybook states plus the styled Storybook accessibility gate."
      },
      "dataBoundary": {
        "kind": "props-only",
        "contract": "The official local primitive receives presentation and interaction props only; routes and adapters retain application data, persistence, transport, and authorization ownership."
      },
      "responsive": [
        "narrow-mobile",
        "wide-desktop"
      ],
      "deprecation": null,
      "evidence": {
        "story": "@/components/ui/alert-dialog.stories.tsx",
        "states": [
          "Trigger",
          "Open",
          "CompactOpen"
        ]
      }
    },
    {
      "id": "primitive-alert",
      "name": "Alert",
      "tier": "element",
      "module": "@/components/ui/alert.tsx",
      "export": "Alert",
      "owner": "frontend-platform",
      "maturity": "stable",
      "distribution": "shell-internal",
      "variants": [
        "Default",
        "Destructive",
        "WithAction",
        "StatusTonesLight",
        "StatusTonesDark"
      ],
      "tokens": [
        "foundation.font.sans",
        "foundation.radius.base",
        "semantic.light.*",
        "semantic.dark.*"
      ],
      "accessibility": {
        "contract": [
          "Use semantic elements and accessible names for every interactive control.",
          "Support keyboard operation and visible focus wherever the pattern is interactive.",
          "Keep serious and critical Storybook accessibility violations at zero."
        ],
        "evidence": "Dedicated Alert Storybook states plus the styled Storybook accessibility gate."
      },
      "dataBoundary": {
        "kind": "props-only",
        "contract": "The official local primitive receives presentation and interaction props only; routes and adapters retain application data, persistence, transport, and authorization ownership."
      },
      "responsive": [
        "narrow-mobile",
        "wide-desktop"
      ],
      "deprecation": null,
      "evidence": {
        "story": "@/components/ui/alert.stories.tsx",
        "states": [
          "Default",
          "Destructive",
          "WithAction",
          "StatusTonesLight",
          "StatusTonesDark"
        ]
      }
    },
    {
      "id": "primitive-attachment",
      "name": "Attachment",
      "tier": "element",
      "module": "@/components/ui/attachment.tsx",
      "export": "Attachment",
      "owner": "frontend-platform",
      "maturity": "stable",
      "distribution": "shell-internal",
      "variants": [
        "Complete",
        "Uploading",
        "Error",
        "Group",
        "SizeMatrix"
      ],
      "tokens": [
        "foundation.font.sans",
        "foundation.radius.base",
        "semantic.light.*",
        "semantic.dark.*"
      ],
      "accessibility": {
        "contract": [
          "Use semantic elements and accessible names for every interactive control.",
          "Support keyboard operation and visible focus wherever the pattern is interactive.",
          "Keep serious and critical Storybook accessibility violations at zero."
        ],
        "evidence": "Dedicated Attachment Storybook states plus the styled Storybook accessibility gate."
      },
      "dataBoundary": {
        "kind": "props-only",
        "contract": "The official local primitive receives presentation and interaction props only; routes and adapters retain application data, persistence, transport, and authorization ownership."
      },
      "responsive": [
        "narrow-mobile",
        "wide-desktop"
      ],
      "deprecation": null,
      "evidence": {
        "story": "@/components/ui/attachment.stories.tsx",
        "states": [
          "Complete",
          "Uploading",
          "Error",
          "Group",
          "SizeMatrix"
        ]
      }
    },
    {
      "id": "primitive-avatar",
      "name": "Avatar",
      "tier": "element",
      "module": "@/components/ui/avatar.tsx",
      "export": "Avatar",
      "owner": "frontend-platform",
      "maturity": "stable",
      "distribution": "shell-internal",
      "variants": [
        "Fallback",
        "Image",
        "Presence",
        "Group"
      ],
      "tokens": [
        "foundation.font.sans",
        "foundation.radius.base",
        "semantic.light.*",
        "semantic.dark.*"
      ],
      "accessibility": {
        "contract": [
          "Use semantic elements and accessible names for every interactive control.",
          "Support keyboard operation and visible focus wherever the pattern is interactive.",
          "Keep serious and critical Storybook accessibility violations at zero."
        ],
        "evidence": "Dedicated Avatar Storybook states plus the styled Storybook accessibility gate."
      },
      "dataBoundary": {
        "kind": "props-only",
        "contract": "The official local primitive receives presentation and interaction props only; routes and adapters retain application data, persistence, transport, and authorization ownership."
      },
      "responsive": [
        "narrow-mobile",
        "wide-desktop"
      ],
      "deprecation": null,
      "evidence": {
        "story": "@/components/ui/avatar.stories.tsx",
        "states": [
          "Fallback",
          "Image",
          "Presence",
          "Group"
        ]
      }
    },
    {
      "id": "primitive-badge",
      "name": "Badge",
      "tier": "element",
      "module": "@/components/ui/badge.tsx",
      "export": "Badge",
      "owner": "frontend-platform",
      "maturity": "stable",
      "distribution": "shell-internal",
      "variants": [
        "Default",
        "Variants",
        "WithIcon"
      ],
      "tokens": [
        "foundation.font.sans",
        "foundation.radius.base",
        "semantic.light.*",
        "semantic.dark.*"
      ],
      "accessibility": {
        "contract": [
          "Use semantic elements and accessible names for every interactive control.",
          "Support keyboard operation and visible focus wherever the pattern is interactive.",
          "Keep serious and critical Storybook accessibility violations at zero."
        ],
        "evidence": "Dedicated Badge Storybook states plus the styled Storybook accessibility gate."
      },
      "dataBoundary": {
        "kind": "props-only",